{"$schema":"https://json-schema.org/draft/2020-12/schema","$id":"espresso.val001.administrative_closure_specification.v1","type":"object","required":["schema_version","record_id","enumeration_roots","included_extensions","outside_root_records","excluded_paths","binding_classes","valid_edges","canonical_lock","administrative_freeze","terminal_external_root","rules","error_disposition"],"properties":{"schema_version":{"const":"espresso.val001.administrative_closure_specification.v1"},"record_id":{"const":"VAL001-ADMINISTRATIVE-CLOSURE-SPECIFICATION-1"},"enumeration_roots":{"type":"array","minItems":1,"items":{"type":"string","pattern":"^(?!/)(?!.*\\.\\.).+$"}},"included_extensions":{"type":"array","minItems":2,"uniqueItems":true,"items":{"enum":[".json",".jsonl"]}},"outside_root_records":{"type":"array","maxItems":0,"items":{"type":"string"}},"excluded_paths":{"type":"array","maxItems":0,"items":{"type":"string"}},"binding_classes":{"type":"array","minItems":4,"maxItems":4,"uniqueItems":true,"items":{"enum":["ORDINARY_HASH_BOUND_RECORD","BOUND_BY_ADMINISTRATIVE_FREEZE","BOUND_BY_CANONICAL_LOCK","BOUND_BY_FINAL_GIT_TREE"]}},"valid_edges":{"type":"array","minItems":4,"items":{"type":"string"}},"canonical_lock":{"type":"string","pattern":"^(?!/)(?!.*\\.\\.).+\\.json$"},"administrative_freeze":{"type":"string","pattern":"^(?!/)(?!.*\\.\\.).+\\.json$"},"terminal_external_root":{"const":"FINAL_GIT_HEAD_TREE"},"rules":{"type":"object","required":["cycle_detection","orphan_detection","duplicate_path_detection","duplicate_record_id_detection","missing_binder_detection","multiple_binders","terminal_root_count","clean_worktree","canonical_lock_git_blob_match"],"properties":{"cycle_detection":{"const":"REQUIRED"},"orphan_detection":{"const":"REQUIRED"},"duplicate_path_detection":{"const":"REQUIRED"},"duplicate_record_id_detection":{"const":"REQUIRED"},"missing_binder_detection":{"const":"REQUIRED"},"multiple_binders":{"const":"PROHIBITED"},"terminal_root_count":{"const":1},"clean_worktree":{"const":"REQUIRED"},"canonical_lock_git_blob_match":{"const":"REQUIRED"}},"additionalProperties":false},"error_disposition":{"const":"FAIL_CLOSED_NO_EXECUTION_AUTHORITY"}},"additionalProperties":false}
